文物名称,时代,图片链接,分类,文物简介
不空成就佛像,10世纪,http://www.dpm.org.cn/Uploads/Picture/dc/1391.jpg,造像,不空成就佛像，10世纪，红铜，通高29.2厘米。清宫旧藏。不空成就佛为五方佛之一，居北方，代表五佛五智中的成所作智，也称羯磨智。此佛一般为禅定式坐姿，如本尊这样的立像造型并不常见。此佛像着通肩袈裟，右手施无畏印，左手下垂牵袈裟一角，稍展右腿，立于单层覆莲座上，莲瓣间起棱线，莲座上缘饰连珠纹一周。莲台下为方形须弥座，中间束腰处阴刻藏文佛名。像后为随身镂孔形式的头光及身光，边沿錾刻曲线表示火焰纹。此像具有典型的喀什米尔造像的造型风格：头戴三叶珠宝佛冠，冠带垂肩；面形饱满，双目大睁；肩头、胸前及袖口、底缘处的袈裟处理得颇显厚重，并錾刻花纹以为装饰；其它部分则薄衣贴体，注重刻划肌肉的起伏变化，肢体浑圆而不失秀气。腹部略饰Ｕ字形浅衣纹，在双腿的衣底边处铸刻曲线以示袈裟的存在。薄衣贴体、注重人体的写实性表现及轻柔流畅的Ｕ字形衣纹等造型特征，是对古印度笈多王朝时期造像传统的继承，这种传统对后来佛教造像的影响十分深远。
金刚亥母铜像,12世纪,http://www.dpm.org.cn/Uploads/Picture/dc/21173.jpg,造像,金刚亥母铜像，12世纪，高19.5厘米。 金刚亥母原是古代苯教中赞神的一种神灵，后来被莲花生大士降伏，成为密教中的本尊或护法。 此像用印度所产的黄铜制成。金刚亥母三目圆睁，头戴骷髅冠，赤发上扬，发间向右侧伸出一猪头。裸身形，项挂人头大璎珞。左手托嘎巴拉碗，象征她获得了极乐的体验，暗示其事业的成功。左臂夹持喀章嘎，喀章嘎是无上瑜伽部母续最常见的法器，它的上端有骷髅、干枯和新鲜的人头，分别代表佛教教义中的贪、嗔、痴“三毒”。右手持钺刀，象征清除人的一切愚昧，勾召真性智慧。右腿蜷起，左腿弯曲独立，呈舞立姿，足踏人尸，动感颇强。右膝倚靠粗壮的莲枝，使金刚亥母像平衡了重心，造像更加牢固。忍冬纹背光、单层简略的莲座和多折角台座是东印度波罗时期最常见的形式。
不动金刚像,元,http://www.dpm.org.cn/Uploads/Picture/dc/2863.jpg,造像,不动金刚像，元，黄铜，通高26厘米。清宫旧藏。不动金刚据言为大日如来的忿怒显化，以降伏魔障，护持佛法。其造型为右手上举，握持长剑横于脑后，左手竖食指、小指，屈中指结期克手印持套索，弓步立姿。此尊不动金刚像红发如日轮，中间有二蛇交缠，头戴五叶冠，冠叶短小疏散，发髻后左右横出发插，是为藏西地区造像特征之一。像胸前佩璎珞，戴臂钏，以盘蛇为手镯、足镯，装饰朴拙简洁。不动金刚大腹圆突，下身着短裙，裙上阴刻旋草纹，是藏西13世纪造像上就已出现的传统装饰性纹样。像右腿弓步而立，双腿蹬踏有力，足下卧伏象面神。莲座莲瓣丰满肥厚，其尖稍卷，上沿饰连珠，下部略外扩，此为东印度帕拉风格造像中的常见形制。像身系原清宫黄签记：“大利益梵铜俐玛……乾隆五十七年（1792年）九月初一日收……”（原签残损）等字，可知此像为乾隆时进献于朝廷的。
毗卢遮那佛像,元,http://www.dpm.org.cn/Uploads/Picture/dc/2864.jpg,造像,毗卢遮那佛像，元，黄铜，通高36厘米。清宫旧藏。毗卢遮那佛，又称大日如来，为密宗金刚界五方如来之首，代表五佛五智中的法界体性智，也是三身佛中的法身佛，神性地位很高。此尊毗卢遮那佛像具有明显的藏西造像的风格特征。佛像全跏趺坐于莲台上，面部至颈涂泥金，双手当胸结智拳印，是为毗卢遮那佛的特有手印。佛像发髻高耸而扁平，头戴五佛冠，冠叶修长呈花枝状，并以铜铸线条连接，这是藏西典型的“撑铸技法”在造型样式上的体现。莲座之莲瓣宽肥，上缘饰双层细密连珠纹，亦为13世纪左右藏西造像之特征。莲座下端外展，底缘饰一圈大连珠纹。五佛冠边缘错嵌红铜，佛像眉间白毫嵌金，两肩各以杂花为饰，上身赤裸，胸、臂上以璎珞、钏镯为严饰，上镶珍珠松石及银铜等，腰部收束，下身著贴体薄裙，腰间及腿上以錾刻的线条和花纹表示出上下衣裙的分别及衣褶，间刻小团花于规则的衣纹间作装饰，以上种种造型及装饰特征有着受东印度帕拉王朝造像风格影响的鲜明印记。此像是保存有较多帕拉风格特征的早期藏西造像的代表作品。
空行母像,明,http://www.dpm.org.cn/Uploads/Picture/dc/1395.jpg,造像,空行母像，明，红铜质地，通高22厘米。清宫旧藏。空行母是一种介乎天人之间的女性神祗，她有大力，可于空中飞行，故名。在密宗中是代表智慧与慈悲的女神。其形貌多变，通常可分为人形与兽面空行母两大类。此尊造像即为人形空行母的常见造型。此空行母像圆面怒目，蛇卷怒发，发丝柔顺光滑。头戴五叶骷髅冠。项挂人首项链，长垂及地。左手屈臂高擎嘎巴拉碗，右手后伸向下持钺刀。左弓步展立姿，仰面朝向左前方，体态优美，极富动感。造像丰乳细腰，肌肉质感塑造准确。上身满饰璎珞，足踏二神。单层覆莲座，莲瓣细长饱满，底板有十字交杵阴阳鱼图案。这件作品造型生动，工艺精良，是明代西藏造像中的佳作。
永乐款铃杵,明永乐,http://www.dpm.org.cn/Uploads/Picture/dc/1398.jpg,祭法器,永乐款铃杵，明永乐，高22.5厘米。清宫旧藏。这套铃杵为明永乐年间所制，内铸“大明永乐年施”，由明代宫廷制造。铃为杵形把首，上有佛首覆莲，并铸有六字真言及璎珞、金刚杵等纹饰。杵为铜镀金五股杵，两端皆出五峰，代表五佛五智。铃是藏传佛教常用法器之一，也称为藏铃、金刚铃等，常在修法时摇响，是诸尊警告有情，使之喜悦的法器。因其体坚固，故称金刚，又因其形为五钴形，故亦称五钴铃。藏传佛教视之为代表智德的法器。杵是佛教法器名，原为古印度的一种兵器，佛教密宗用以示坚利之智，是断烦恼、伏恶魔的法器。用金、银、铜、铁或硬木制成，长八指至十六指，其中以十六指为上，十二指为中，八指为下，两端有独股、三股、五股。一般认为金刚杵象征菩提心，不持金刚杵念佛，念佛就达不到目的。永乐四年（1406年），西藏尚师哈立麻千里迢迢，到南京觐见永乐帝，受到隆重的礼遇。此铃杵即在永乐帝赐物之中。
铜鎏金秘密文殊菩萨坐像,明永乐,http://www.dpm.org.cn/Uploads/Picture/dc/52840.jpg,造像,铜鎏金秘密文殊菩萨坐像，明永乐，通高19.5厘米，底宽11.8厘米，底厚8.5厘米。清宫旧藏。文殊菩萨坐像一头四臂，面相浑圆秀美，垂目俯视，神态安详。头戴五叶宝冠，袒上身，细腰束裙，褶纹转折自如，起伏流畅，潇洒飘逸。主臂右手上举持剑，左手结期克印牵莲花茎，另外两手右手持箭，左手上举持弓，全跏趺坐。端坐于仰覆莲座，莲瓣细长挺拔，上下边缘饰联珠纹。座面阴刻“大明永乐年施”楷书款。
